{
  "article_id": "ART-20260805-0002",
  "topic_id": "TOP-0001",
  "title_original": "Sample article without disclosed settlement amount",
  "title_ko": null,
  "source_name": "Sample News",
  "source_type": "news_rss",
  "source_url": "https://example.com/original-article-2",
  "canonical_url": "https://example.com/original-article-2",
  "published_at": "2026-07-31T09:00:00Z",
  "collected_at": "2026-07-31T10:00:00Z",
  "language": "en",
  "country": "US",
  "summary_ko": null,
  "litigation_amount_total": null,
  "litigation_currency": null,
  "litigation_amount_total_usd": null,
  "claimant_count": null,
  "average_amount_per_person_usd": null,
  "related_companies": [],
  "related_lx_companies": [],
  "event_type": "regulation",
  "confidence_score": 0.4,
  "source_reliability_grade": "C",
  "duplicate_group_id": null,
  "is_new_change": false,
  "status": "collected"
}
