{
  "article_id": "ART-20260805-0001",
  "topic_id": "TOP-0001",
  "title_original": "Sample engineered stone silicosis lawsuit filed in California",
  "title_ko": "캘리포니아에서 엔지니어드스톤 실리코시스 소송 제기 (샘플)",
  "source_name": "Sample News",
  "source_type": "news_rss",
  "source_url": "https://example.com/original-article",
  "canonical_url": "https://example.com/original-article",
  "published_at": "2026-07-30T09:00:00Z",
  "collected_at": "2026-07-30T10:00:00Z",
  "language": "en",
  "country": "US",
  "summary_ko": "샘플 요약",
  "litigation_amount_total": 5000000,
  "litigation_currency": "USD",
  "litigation_amount_total_usd": 5000000,
  "claimant_count": 5,
  "average_amount_per_person_usd": 1000000,
  "related_companies": ["Sample Corp"],
  "related_lx_companies": ["LX_HAUSYS"],
  "event_type": "litigation",
  "confidence_score": 0.8,
  "source_reliability_grade": "B",
  "duplicate_group_id": null,
  "is_new_change": true,
  "status": "collected"
}
